14:25:51.932550 IP 160.97.62.90.62536 > 224.0.0.252.5355: UDP, length 21
14:25:51.932586 IP 160.97.62.90.62840 > 224.0.0.252.5355: UDP, length 21
14:25:52.342929 IP 160.97.62.90.62536 > 224.0.0.252.5355: UDP, length 21
14:25:52.342996 IP 160.97.62.90.62840 > 224.0.0.252.5355: UDP, length 21
14:25:52.631764 IP 192.168.0.100.41977 > 172.217.23.106.443: UDP, length 76
14:25:52.631829 IP 192.168.0.100.41977 > 172.217.23.106.443: UDP, length 131
14:25:52.652989 IP 172.217.23.106.443 > 192.168.0.100.41977: UDP, length 30
14:25:52.895087 IP 172.217.23.106.443 > 192.168.0.100.41977: UDP, length 376
14:25:52.895123 IP 172.217.23.106.443 > 192.168.0.100.41977: UDP, length 269
14:25:52.895339 IP 192.168.0.100.41977 > 172.217.23.106.443: UDP, length 44
14:25:53.010592 IP 192.168.0.1.50080 > 239.255.255.250.1900: UDP, length 264
14:25:53.114205 IP 192.168.0.1.50080 > 239.255.255.250.1900: UDP, length 273
14:25:53.218232 IP 192.168.0.1.50080 > 239.255.255.250.1900: UDP, length 336
14:25:53.319441 IP 192.168.0.100.54299 > 192.168.0.1.53: 44428+ [1au] A? code.jquery.com. (66)
14:25:53.319548 IP 192.168.0.100.56201 > 160.97.62.2.53: 25035+ [1au] A? code.jquery.com. (66)
14:25:53.320951 IP 192.168.0.100.58648 > 160.97.62.2.53: 33041+ [1au] A? www.googletagmanager.com. (75)
14:25:53.320984 IP 192.168.0.1.53 > 192.168.0.100.54299: 44428 3/8/9 CNAME code.jquery.netdna-cdn.com., A 151.139.237.113, A 94.31.29.54 (463)
14:25:53.320999 IP 160.97.62.2.53 > 192.168.0.100.56201: 25035 3/8/9 CNAME code.jquery.netdna-cdn.com., A 94.31.29.54, A 151.139.237.113 (463)
14:25:53.321096 IP 192.168.0.100.40694 > 192.168.0.1.53: 54344+ [1au] A? www-googletagmanager.l.google.com. (84)
14:25:53.321134 IP 192.168.0.100.58908 > 160.97.62.2.53: 23964+ [1au] A? www-googletagmanager.l.google.com. (84)
14:25:53.321338 IP 192.168.0.100.60511 > 160.97.62.2.53: 4245+ [1au] A? code.jquery.netdna-cdn.com. (77)
14:25:53.321649 IP 192.168.0.100.60988 > 94.31.29.54.443: Flags [S], seq 1679241984, win 29200, options [mss 1460,sackOK,TS val 3993015156 ecr 0,nop,wscale 7], length 0
14:25:53.322206 IP 192.168.0.100.32865 > 192.168.0.1.53: 42363+ [1au] A? www.mat.unical.it. (68)
14:25:53.322221 IP 160.97.62.2.53 > 192.168.0.100.58648: 33041 2/4/5 CNAME www-googletagmanager.l.google.com., A 216.58.205.200 (249)
14:25:53.322245 IP 192.168.0.100 > 160.97.62.2: ICMP 192.168.0.100 udp port 58648 unreachable, length 285
14:25:53.322248 IP 192.168.0.1.53 > 192.168.0.100.40694: 54344 1/4/5 A 216.58.205.200 (214)
14:25:53.322260 IP 160.97.62.2.53 > 192.168.0.100.58908: 23964 1/4/5 A 216.58.205.200 (214)
14:25:53.322264 IP 192.168.0.1.50080 > 239.255.255.250.1900: UDP, length 328
14:25:53.322342 IP 192.168.0.100.48932 > 192.168.0.1.53: 1014+ [1au] A? sv.mat.unical.it. (67)
14:25:53.322857 IP 160.97.62.2.53 > 192.168.0.100.60511: 4245 2/8/9 A 151.139.237.113, A 94.31.29.54 (437)
14:25:53.322896 IP 192.168.0.100 > 160.97.62.2: ICMP 192.168.0.100 udp port 60511 unreachable, length 473
14:25:53.322898 IP 192.168.0.1.53 > 192.168.0.100.32865: 42363* 2/1/2 CNAME sv.mat.unical.it., A 160.97.62.1 (112)
14:25:53.322916 IP 192.168.0.100 > 192.168.0.1: ICMP 192.168.0.100 udp port 32865 unreachable, length 148
14:25:53.323570 IP 192.168.0.1.53 > 192.168.0.100.48932: 1014* 1/1/2 A 160.97.62.1 (94)
14:25:53.323589 IP 192.168.0.100 > 192.168.0.1: ICMP 192.168.0.100 udp port 48932 unreachable, length 130
14:25:53.325453 IP 192.168.0.100.47172 > 216.58.205.200.443: UDP, length 1350
14:25:53.325545 IP 192.168.0.100.52148 > 160.97.62.1.443: Flags [S], seq 1056289747, win 29200, options [mss 1460,sackOK,TS val 3671661364 ecr 0,nop,wscale 7], length 0
14:25:53.325574 IP 192.168.0.100.52150 > 160.97.62.1.443: Flags [S], seq 1821000961, win 29200, options [mss 1460,sackOK,TS val 3671661364 ecr 0,nop,wscale 7], length 0
14:25:53.325592 IP 192.168.0.100.52152 > 160.97.62.1.443: Flags [S], seq 354520213, win 29200, options [mss 1460,sackOK,TS val 3671661364 ecr 0,nop,wscale 7], length 0
14:25:53.325624 IP 192.168.0.100.52154 > 160.97.62.1.443: Flags [S], seq 693160470, win 29200, options [mss 1460,sackOK,TS val 3671661364 ecr 0,nop,wscale 7], length 0
14:25:53.325642 IP 192.168.0.100.52156 > 160.97.62.1.443: Flags [S], seq 2345497530, win 29200, options [mss 1460,sackOK,TS val 3671661364 ecr 0,nop,wscale 7], length 0
14:25:53.325655 IP 192.168.0.100.52158 > 160.97.62.1.443: Flags [S], seq 4240646682, win 29200, options [mss 1460,sackOK,TS val 3671661364 ecr 0,nop,wscale 7], length 0
14:25:53.327327 IP 160.97.62.1.443 > 192.168.0.100.52148: Flags [S.], seq 1513529091, ack 1056289748, win 14480, options [mss 1340,sackOK,TS val 3627867679 ecr 3671661364,nop,wscale 4], length 0
14:25:53.327364 IP 192.168.0.100.52148 > 160.97.62.1.443: Flags [.], ack 1, win 229, options [nop,nop,TS val 3671661364 ecr 3627867679], length 0
14:25:53.327368 IP 160.97.62.1.443 > 192.168.0.100.52150: Flags [S.], seq 1676736387, ack 1821000962, win 14480, options [mss 1340,sackOK,TS val 3627867679 ecr 3671661364,nop,wscale 4], length 0
14:25:53.327381 IP 192.168.0.100.52150 > 160.97.62.1.443: Flags [.], ack 1, win 229, options [nop,nop,TS val 3671661364 ecr 3627867679], length 0
14:25:53.327383 IP 160.97.62.1.443 > 192.168.0.100.52152: Flags [S.], seq 2355249046, ack 354520214, win 14480, options [mss 1340,sackOK,TS val 3627867679 ecr 3671661364,nop,wscale 4], length 0
14:25:53.327393 IP 192.168.0.100.52152 > 160.97.62.1.443: Flags [.], ack 1, win 229, options [nop,nop,TS val 3671661364 ecr 3627867679], length 0
14:25:53.327394 IP 160.97.62.1.443 > 192.168.0.100.52154: Flags [S.], seq 3751064173, ack 693160471, win 14480, options [mss 1340,sackOK,TS val 3627867679 ecr 3671661364,nop,wscale 4], length 0
14:25:53.327403 IP 192.168.0.100.52154 > 160.97.62.1.443: Flags [.], ack 1, win 229, options [nop,nop,TS val 3671661364 ecr 3627867679], length 0
14:25:53.327405 IP 160.97.62.1.443 > 192.168.0.100.52156: Flags [S.], seq 587317501, ack 2345497531, win 14480, options [mss 1340,sackOK,TS val 3627867679 ecr 3671661364,nop,wscale 4], length 0
14:25:53.327413 IP 192.168.0.100.52156 > 160.97.62.1.443: Flags [.], ack 1, win 229, options [nop,nop,TS val 3671661364 ecr 3627867679], length 0
14:25:53.327414 IP 160.97.62.1.443 > 192.168.0.100.52158: Flags [S.], seq 2595868667, ack 4240646683, win 14480, options [mss 1340,sackOK,TS val 3627867679 ecr 3671661364,nop,wscale 4], length 0
14:25:53.327423 IP 192.168.0.100.52158 > 160.97.62.1.443: Flags [.], ack 1, win 229, options [nop,nop,TS val 3671661364 ecr 3627867679], length 0
14:25:53.327693 IP 192.168.0.100.52148 > 160.97.62.1.443: Flags [P.], seq 1:518, ack 1, win 229, options [nop,nop,TS val 3671661364 ecr 3627867679], length 517
14:25:53.327782 IP 192.168.0.100.52150 > 160.97.62.1.443: Flags [P.], seq 1:518, ack 1, win 229, options [nop,nop,TS val 3671661364 ecr 3627867679], length 517
14:25:53.327856 IP 192.168.0.100.52152 > 160.97.62.1.443: Flags [P.], seq 1:518, ack 1, win 229, options [nop,nop,TS val 3671661364 ecr 3627867679], length 517
14:25:53.327941 IP 192.168.0.100.52154 > 160.97.62.1.443: Flags [P.], seq 1:518, ack 1, win 229, options [nop,nop,TS val 3671661364 ecr 3627867679], length 517
14:25:53.328054 IP 192.168.0.100.52156 > 160.97.62.1.443: Flags [P.], seq 1:518, ack 1, win 229, options [nop,nop,TS val 3671661364 ecr 3627867679], length 517
14:25:53.328136 IP 192.168.0.100.52158 > 160.97.62.1.443: Flags [P.], seq 1:518, ack 1, win 229, options [nop,nop,TS val 3671661364 ecr 3627867679], length 517
14:25:53.329040 IP 160.97.62.1.443 > 192.168.0.100.52148: Flags [.], ack 518, win 972, options [nop,nop,TS val 3627867680 ecr 3671661364], length 0
14:25:53.329065 IP 160.97.62.1.443 > 192.168.0.100.52150: Flags [.], ack 518, win 972, options [nop,nop,TS val 3627867680 ecr 3671661364], length 0
14:25:53.329069 IP 160.97.62.1.443 > 192.168.0.100.52152: Flags [.], ack 518, win 972, options [nop,nop,TS val 3627867680 ecr 3671661364], length 0
14:25:53.329071 IP 160.97.62.1.443 > 192.168.0.100.52154: Flags [.], ack 518, win 972, options [nop,nop,TS val 3627867680 ecr 3671661364], length 0
14:25:53.329074 IP 160.97.62.1.443 > 192.168.0.100.52156: Flags [.], ack 518, win 972, options [nop,nop,TS val 3627867680 ecr 3671661364], length 0
14:25:53.329077 IP 160.97.62.1.443 > 192.168.0.100.52158: Flags [.], ack 518, win 972, options [nop,nop,TS val 3627867680 ecr 3671661364], length 0
14:25:53.345170 IP 160.97.62.1.443 > 192.168.0.100.52148: Flags [P.], seq 1:5685, ack 518, win 972, options [nop,nop,TS val 3627867684 ecr 3671661364], length 5684
14:25:53.345204 IP 192.168.0.100.52148 > 160.97.62.1.443: Flags [.], ack 5685, win 317, options [nop,nop,TS val 3671661369 ecr 3627867684], length 0
14:25:53.346086 IP 192.168.0.100.52148 > 160.97.62.1.443: Flags [P.], seq 518:644, ack 5685, win 317, options [nop,nop,TS val 3671661369 ecr 3627867684], length 126
14:25:53.357537 IP 160.97.62.1.443 > 192.168.0.100.52154: Flags [P.], seq 1:5685, ack 518, win 972, options [nop,nop,TS val 3627867687 ecr 3671661364], length 5684
14:25:53.357546 IP 192.168.0.100.47172 > 216.58.205.200.443: UDP, length 1350
14:25:53.357567 IP 192.168.0.100.52154 > 160.97.62.1.443: Flags [.], ack 5685, win 317, options [nop,nop,TS val 3671661372 ecr 3627867687], length 0
14:25:53.357578 IP 160.97.62.1.443 > 192.168.0.100.52152: Flags [.], seq 1:1329, ack 518, win 972, options [nop,nop,TS val 3627867687 ecr 3671661364], length 1328
14:25:53.357586 IP 192.168.0.100.52152 > 160.97.62.1.443: Flags [.], ack 1329, win 251, options [nop,nop,TS val 3671661372 ecr 3627867687], length 0
14:25:53.358138 IP 160.97.62.1.443 > 192.168.0.100.52152: Flags [P.], seq 1329:5685, ack 518, win 972, options [nop,nop,TS val 3627867687 ecr 3671661364], length 4356
14:25:53.358152 IP 192.168.0.100.52152 > 160.97.62.1.443: Flags [.], ack 5685, win 319, options [nop,nop,TS val 3671661372 ecr 3627867687], length 0
14:25:53.358159 IP 160.97.62.1.443 > 192.168.0.100.52150: Flags [.], seq 1:2657, ack 518, win 972, options [nop,nop,TS val 3627867687 ecr 3671661364], length 2656
14:25:53.358166 IP 192.168.0.100.52150 > 160.97.62.1.443: Flags [.], ack 2657, win 270, options [nop,nop,TS val 3671661372 ecr 3627867687], length 0
14:25:53.358479 IP 192.168.0.100.52154 > 160.97.62.1.443: Flags [P.], seq 518:644, ack 5685, win 317, options [nop,nop,TS val 3671661372 ecr 3627867687], length 126
14:25:53.358826 IP 160.97.62.1.443 > 192.168.0.100.52150: Flags [P.], seq 2657:5685, ack 518, win 972, options [nop,nop,TS val 3627867687 ecr 3671661364], length 3028
14:25:53.358837 IP 192.168.0.100.52150 > 160.97.62.1.443: Flags [.], ack 5685, win 317, options [nop,nop,TS val 3671661372 ecr 3627867687], length 0
14:25:53.358839 IP 160.97.62.1.443 > 192.168.0.100.52148: Flags [P.], seq 5685:5959, ack 644, win 972, options [nop,nop,TS val 3627867687 ecr 3671661369], length 274
14:25:53.359222 IP 192.168.0.100.52152 > 160.97.62.1.443: Flags [P.], seq 518:644, ack 5685, win 319, options [nop,nop,TS val 3671661372 ecr 3627867687], length 126
14:25:53.359840 IP 192.168.0.100.52150 > 160.97.62.1.443: Flags [P.], seq 518:644, ack 5685, win 317, options [nop,nop,TS val 3671661372 ecr 3627867687], length 126
14:25:53.360039 IP 192.168.0.100.52148 > 160.97.62.1.443: Flags [P.], seq 644:1303, ack 5959, win 338, options [nop,nop,TS val 3671661372 ecr 3627867687], length 659
14:25:53.361111 IP 160.97.62.1.443 > 192.168.0.100.52158: Flags [P.], seq 1:5685, ack 518, win 972, options [nop,nop,TS val 3627867688 ecr 3671661364], length 5684
14:25:53.361126 IP 192.168.0.100.52158 > 160.97.62.1.443: Flags [.], ack 5685, win 317, options [nop,nop,TS val 3671661373 ecr 3627867688], length 0
14:25:53.361131 IP 160.97.62.1.443 > 192.168.0.100.52156: Flags [.], seq 1:1329, ack 518, win 972, options [nop,nop,TS val 3627867688 ecr 3671661364], length 1328
14:25:53.361135 IP 192.168.0.100.52156 > 160.97.62.1.443: Flags [.], ack 1329, win 251, options [nop,nop,TS val 3671661373 ecr 3627867688], length 0
14:25:53.361771 IP 160.97.62.1.443 > 192.168.0.100.52156: Flags [P.], seq 1329:5685, ack 518, win 972, options [nop,nop,TS val 3627867688 ecr 3671661364], length 4356
14:25:53.361786 IP 192.168.0.100.52156 > 160.97.62.1.443: Flags [.], ack 5685, win 319, options [nop,nop,TS val 3671661373 ecr 3627867688], length 0
14:25:53.361788 IP 160.97.62.1.443 > 192.168.0.100.52154: Flags [P.], seq 5685:5959, ack 644, win 972, options [nop,nop,TS val 3627867688 ecr 3671661372], length 274
14:25:53.361929 IP 192.168.0.100.52158 > 160.97.62.1.443: Flags [P.], seq 518:644, ack 5685, win 317, options [nop,nop,TS val 3671661373 ecr 3627867688], length 126
14:25:53.362422 IP 160.97.62.1.443 > 192.168.0.100.52150: Flags [P.], seq 5685:5959, ack 644, win 972, options [nop,nop,TS val 3627867688 ecr 3671661372], length 274
14:25:53.362434 IP 160.97.62.1.443 > 192.168.0.100.52152: Flags [P.], seq 5685:5959, ack 644, win 972, options [nop,nop,TS val 3627867688 ecr 3671661372], length 274
14:25:53.362674 IP 192.168.0.100.52156 > 160.97.62.1.443: Flags [P.], seq 518:644, ack 5685, win 319, options [nop,nop,TS val 3671661373 ecr 3627867688], length 126
14:25:53.363382 IP 94.31.29.54.443 > 192.168.0.100.60988: Flags [S.], seq 1152989205, ack 1679241985, win 29200, options [mss 1340,nop,nop,sackOK,nop,wscale 10], length 0
14:25:53.363399 IP 192.168.0.100.60988 > 94.31.29.54.443: Flags [.], ack 1, win 229, length 0
14:25:53.363478 IP 192.168.0.100.60988 > 94.31.29.54.443: Flags [P.], seq 1:204, ack 1, win 229, length 203
14:25:53.364392 IP 216.58.205.200.443 > 192.168.0.100.47172: UDP, length 1350