14:25:51.932550 IP 160.97.62.90.62536 > 224.0.0.252.5355: UDP, length 21
14:25:51.932586 IP 160.97.62.90.62840 > 224.0.0.252.5355: UDP, length 21
14:25:52.342929 IP 160.97.62.90.62536 > 224.0.0.252.5355: UDP, length 21
14:25:52.342996 IP 160.97.62.90.62840 > 224.0.0.252.5355: UDP, length 21
14:25:52.631764 IP 192.168.0.100.41977 > 172.217.23.106.443: UDP, length 76
14:25:52.631829 IP 192.168.0.100.41977 > 172.217.23.106.443: UDP, length 131
14:25:52.652989 IP 172.217.23.106.443 > 192.168.0.100.41977: UDP, length 30
14:25:52.895087 IP 172.217.23.106.443 > 192.168.0.100.41977: UDP, length 376
14:25:52.895123 IP 172.217.23.106.443 > 192.168.0.100.41977: UDP, length 269
14:25:52.895339 IP 192.168.0.100.41977 > 172.217.23.106.443: UDP, length 44
14:25:53.010592 IP 192.168.0.1.50080 > 239.255.255.250.1900: UDP, length 264
14:25:53.114205 IP 192.168.0.1.50080 > 239.255.255.250.1900: UDP, length 273
14:25:53.218232 IP 192.168.0.1.50080 > 239.255.255.250.1900: UDP, length 336
14:25:53.319441 IP 192.168.0.100.54299 > 192.168.0.1.53: 44428+ [1au] A? code.jquery.com. (66)
14:25:53.319548 IP 192.168.0.100.56201 > 160.97.62.2.53: 25035+ [1au] A? code.jquery.com. (66)
14:25:53.320951 IP 192.168.0.100.58648 > 160.97.62.2.53: 33041+ [1au] A? www.googletagmanager.com. (75)
14:25:53.320984 IP 192.168.0.1.53 > 192.168.0.100.54299: 44428 3/8/9 CNAME code.jquery.netdna-cdn.com., A 151.139.237.113, A 94.31.29.54 (463)
14:25:53.320999 IP 160.97.62.2.53 > 192.168.0.100.56201: 25035 3/8/9 CNAME code.jquery.netdna-cdn.com., A 94.31.29.54, A 151.139.237.113 (463)
14:25:53.321096 IP 192.168.0.100.40694 > 192.168.0.1.53: 54344+ [1au] A? www-googletagmanager.l.google.com. (84)
14:25:53.321134 IP 192.168.0.100.58908 > 160.97.62.2.53: 23964+ [1au] A? www-googletagmanager.l.google.com. (84)
14:25:53.321338 IP 192.168.0.100.60511 > 160.97.62.2.53: 4245+ [1au] A? code.jquery.netdna-cdn.com. (77)
14:25:53.321649 IP 192.168.0.100.60988 > 94.31.29.54.443: Flags [S], seq 1679241984, win 29200, options [mss 1460,sackOK,TS val 3993015156 ecr 0,nop,wscale 7], length 0
14:25:53.322206 IP 192.168.0.100.32865 > 192.168.0.1.53: 42363+ [1au] A? www.mat.unical.it. (68)
14:25:53.322221 IP 160.97.62.2.53 > 192.168.0.100.58648: 33041 2/4/5 CNAME www-googletagmanager.l.google.com., A 216.58.205.200 (249)
14:25:53.322245 IP 192.168.0.100 > 160.97.62.2: ICMP 192.168.0.100 udp port 58648 unreachable, length 285
14:25:53.322248 IP 192.168.0.1.53 > 192.168.0.100.40694: 54344 1/4/5 A 216.58.205.200 (214)
14:25:53.322260 IP 160.97.62.2.53 > 192.168.0.100.58908: 23964 1/4/5 A 216.58.205.200 (214)
14:25:53.322264 IP 192.168.0.1.50080 > 239.255.255.250.1900: UDP, length 328
14:25:53.322342 IP 192.168.0.100.48932 > 192.168.0.1.53: 1014+ [1au] A? sv.mat.unical.it. (67)
14:25:53.322857 IP 160.97.62.2.53 > 192.168.0.100.60511: 4245 2/8/9 A 151.139.237.113, A 94.31.29.54 (437)
14:25:53.322896 IP 192.168.0.100 > 160.97.62.2: ICMP 192.168.0.100 udp port 60511 unreachable, length 473
14:25:53.322898 IP 192.168.0.1.53 > 192.168.0.100.32865: 42363* 2/1/2 CNAME sv.mat.unical.it., A 160.97.62.1 (112)
14:25:53.322916 IP 192.168.0.100 > 192.168.0.1: ICMP 192.168.0.100 udp port 32865 unreachable, length 148
14:25:53.323570 IP 192.168.0.1.53 > 192.168.0.100.48932: 1014* 1/1/2 A 160.97.62.1 (94)
14:25:53.323589 IP 192.168.0.100 > 192.168.0.1: ICMP 192.168.0.100 udp port 48932 unreachable, length 130
14:25:53.325453 IP 192.168.0.100.47172 > 216.58.205.200.443: UDP, length 1350
14:25:53.325545 IP 192.168.0.100.52148 > 160.97.62.1.443: Flags [S], seq 1056289747, win 29200, options [mss 1460,sackOK,TS val 3671661364 ecr 0,nop,wscale 7], length 0
14:25:53.325574 IP 192.168.0.100.52150 > 160.97.62.1.443: Flags [S], seq 1821000961, win 29200, options [mss 1460,sackOK,TS val 3671661364 ecr 0,nop,wscale 7], length 0
14:25:53.325592 IP 192.168.0.100.52152 > 160.97.62.1.443: Flags [S], seq 354520213, win 29200, options [mss 1460,sackOK,TS val 3671661364 ecr 0,nop,wscale 7], length 0
14:25:53.325624 IP 192.168.0.100.52154 > 160.97.62.1.443: Flags [S], seq 693160470, win 29200, options [mss 1460,sackOK,TS val 3671661364 ecr 0,nop,wscale 7], length 0
14:25:53.325642 IP 192.168.0.100.52156 > 160.97.62.1.443: Flags [S], seq 2345497530, win 29200, options [mss 1460,sackOK,TS val 3671661364 ecr 0,nop,wscale 7], length 0
14:25:53.325655 IP 192.168.0.100.52158 > 160.97.62.1.443: Flags [S], seq 4240646682, win 29200, options [mss 1460,sackOK,TS val 3671661364 ecr 0,nop,wscale 7], length 0
14:25:53.327327 IP 160.97.62.1.443 > 192.168.0.100.52148: Flags [S.], seq 1513529091, ack 1056289748, win 14480, options [mss 1340,sackOK,TS val 3627867679 ecr 3671661364,nop,wscale 4], length 0
14:25:53.327364 IP 192.168.0.100.52148 > 160.97.62.1.443: Flags [.], ack 1, win 229, options [nop,nop,TS val 3671661364 ecr 3627867679], length 0
14:25:53.327368 IP 160.97.62.1.443 > 192.168.0.100.52150: Flags [S.], seq 1676736387, ack 1821000962, win 14480, options [mss 1340,sackOK,TS val 3627867679 ecr 3671661364,nop,wscale 4], length 0
14:25:53.327381 IP 192.168.0.100.52150 > 160.97.62.1.443: Flags [.], ack 1, win 229, options [nop,nop,TS val 3671661364 ecr 3627867679], length 0
14:25:53.327383 IP 160.97.62.1.443 > 192.168.0.100.52152: Flags [S.], seq 2355249046, ack 354520214, win 14480, options [mss 1340,sackOK,TS val 3627867679 ecr 3671661364,nop,wscale 4], length 0
14:25:53.327393 IP 192.168.0.100.52152 > 160.97.62.1.443: Flags [.], ack 1, win 229, options [nop,nop,TS val 3671661364 ecr 3627867679], length 0
14:25:53.327394 IP 160.97.62.1.443 > 192.168.0.100.52154: Flags [S.], seq 3751064173, ack 693160471, win 14480, options [mss 1340,sackOK,TS val 3627867679 ecr 3671661364,nop,wscale 4], length 0
14:25:53.327403 IP 192.168.0.100.52154 > 160.97.62.1.443: Flags [.], ack 1, win 229, options [nop,nop,TS val 3671661364 ecr 3627867679], length 0
14:25:53.327405 IP 160.97.62.1.443 > 192.168.0.100.52156: Flags [S.], seq 587317501, ack 2345497531, win 14480, options [mss 1340,sackOK,TS val 3627867679 ecr 3671661364,nop,wscale 4], length 0
14:25:53.327413 IP 192.168.0.100.52156 > 160.97.62.1.443: Flags [.], ack 1, win 229, options [nop,nop,TS val 3671661364 ecr 3627867679], length 0
14:25:53.327414 IP 160.97.62.1.443 > 192.168.0.100.52158: Flags [S.], seq 2595868667, ack 4240646683, win 14480, options [mss 1340,sackOK,TS val 3627867679 ecr 3671661364,nop,wscale 4], length 0
14:25:53.327423 IP 192.168.0.100.52158 > 160.97.62.1.443: Flags [.], ack 1, win 229, options [nop,nop,TS val 3671661364 ecr 3627867679], length 0
14:25:53.327693 IP 192.168.0.100.52148 > 160.97.62.1.443: Flags [P.], seq 1:518, ack 1, win 229, options [nop,nop,TS val 3671661364 ecr 3627867679], length 517
14:25:53.327782 IP 192.168.0.100.52150 > 160.97.62.1.443: Flags [P.], seq 1:518, ack 1, win 229, options [nop,nop,TS val 3671661364 ecr 3627867679], length 517
14:25:53.327856 IP 192.168.0.100.52152 > 160.97.62.1.443: Flags [P.], seq 1:518, ack 1, win 229, options [nop,nop,TS val 3671661364 ecr 3627867679], length 517
14:25:53.327941 IP 192.168.0.100.52154 > 160.97.62.1.443: Flags [P.], seq 1:518, ack 1, win 229, options [nop,nop,TS val 3671661364 ecr 3627867679], length 517
14:25:53.328054 IP 192.168.0.100.52156 > 160.97.62.1.443: Flags [P.], seq 1:518, ack 1, win 229, options [nop,nop,TS val 3671661364 ecr 3627867679], length 517
14:25:53.328136 IP 192.168.0.100.52158 > 160.97.62.1.443: Flags [P.], seq 1:518, ack 1, win 229, options [nop,nop,TS val 3671661364 ecr 3627867679], length 517
14:25:53.329040 IP 160.97.62.1.443 > 192.168.0.100.52148: Flags [.], ack 518, win 972, options [nop,nop,TS val 3627867680 ecr 3671661364], length 0
14:25:53.329065 IP 160.97.62.1.443 > 192.168.0.100.52150: Flags [.], ack 518, win 972, options [nop,nop,TS val 3627867680 ecr 3671661364], length 0
14:25:53.329069 IP 160.97.62.1.443 > 192.168.0.100.52152: Flags [.], ack 518, win 972, options [nop,nop,TS val 3627867680 ecr 3671661364], length 0
14:25:53.329071 IP 160.97.62.1.443 > 192.168.0.100.52154: Flags [.], ack 518, win 972, options [nop,nop,TS val 3627867680 ecr 3671661364], length 0
14:25:53.329074 IP 160.97.62.1.443 > 192.168.0.100.52156: Flags [.], ack 518, win 972, options [nop,nop,TS val 3627867680 ecr 3671661364], length 0
14:25:53.329077 IP 160.97.62.1.443 > 192.168.0.100.52158: Flags [.], ack 518, win 972, options [nop,nop,TS val 3627867680 ecr 3671661364], length 0
14:25:53.345170 IP 160.97.62.1.443 > 192.168.0.100.52148: Flags [P.], seq 1:5685, ack 518, win 972, options [nop,nop,TS val 3627867684 ecr 3671661364], length 5684
14:25:53.345204 IP 192.168.0.100.52148 > 160.97.62.1.443: Flags [.], ack 5685, win 317, options [nop,nop,TS val 3671661369 ecr 3627867684], length 0
14:25:53.346086 IP 192.168.0.100.52148 > 160.97.62.1.443: Flags [P.], seq 518:644, ack 5685, win 317, options [nop,nop,TS val 3671661369 ecr 3627867684], length 126
14:25:53.357537 IP 160.97.62.1.443 > 192.168.0.100.52154: Flags [P.], seq 1:5685, ack 518, win 972, options [nop,nop,TS val 3627867687 ecr 3671661364], length 5684
14:25:53.357546 IP 192.168.0.100.47172 > 216.58.205.200.443: UDP, length 1350
14:25:53.357567 IP 192.168.0.100.52154 > 160.97.62.1.443: Flags [.], ack 5685, win 317, options [nop,nop,TS val 3671661372 ecr 3627867687], length 0
14:25:53.357578 IP 160.97.62.1.443 > 192.168.0.100.52152: Flags [.], seq 1:1329, ack 518, win 972, options [nop,nop,TS val 3627867687 ecr 3671661364], length 1328
14:25:53.357586 IP 192.168.0.100.52152 > 160.97.62.1.443: Flags [.], ack 1329, win 251, options [nop,nop,TS val 3671661372 ecr 3627867687], length 0
14:25:53.358138 IP 160.97.62.1.443 > 192.168.0.100.52152: Flags [P.], seq 1329:5685, ack 518, win 972, options [nop,nop,TS val 3627867687 ecr 3671661364], length 4356
14:25:53.358152 IP 192.168.0.100.52152 > 160.97.62.1.443: Flags [.], ack 5685, win 319, options [nop,nop,TS val 3671661372 ecr 3627867687], length 0
14:25:53.358159 IP 160.97.62.1.443 > 192.168.0.100.52150: Flags [.], seq 1:2657, ack 518, win 972, options [nop,nop,TS val 3627867687 ecr 3671661364], length 2656
14:25:53.358166 IP 192.168.0.100.52150 > 160.97.62.1.443: Flags [.], ack 2657, win 270, options [nop,nop,TS val 3671661372 ecr 3627867687], length 0
14:25:53.358479 IP 192.168.0.100.52154 > 160.97.62.1.443: Flags [P.], seq 518:644, ack 5685, win 317, options [nop,nop,TS val 3671661372 ecr 3627867687], length 126
14:25:53.358826 IP 160.97.62.1.443 > 192.168.0.100.52150: Flags [P.], seq 2657:5685, ack 518, win 972, options [nop,nop,TS val 3627867687 ecr 3671661364], length 3028
14:25:53.358837 IP 192.168.0.100.52150 > 160.97.62.1.443: Flags [.], ack 5685, win 317, options [nop,nop,TS val 3671661372 ecr 3627867687], length 0
14:25:53.358839 IP 160.97.62.1.443 > 192.168.0.100.52148: Flags [P.], seq 5685:5959, ack 644, win 972, options [nop,nop,TS val 3627867687 ecr 3671661369], length 274
14:25:53.359222 IP 192.168.0.100.52152 > 160.97.62.1.443: Flags [P.], seq 518:644, ack 5685, win 319, options [nop,nop,TS val 3671661372 ecr 3627867687], length 126
14:25:53.359840 IP 192.168.0.100.52150 > 160.97.62.1.443: Flags [P.], seq 518:644, ack 5685, win 317, options [nop,nop,TS val 3671661372 ecr 3627867687], length 126
14:25:53.360039 IP 192.168.0.100.52148 > 160.97.62.1.443: Flags [P.], seq 644:1303, ack 5959, win 338, options [nop,nop,TS val 3671661372 ecr 3627867687], length 659
14:25:53.361111 IP 160.97.62.1.443 > 192.168.0.100.52158: Flags [P.], seq 1:5685, ack 518, win 972, options [nop,nop,TS val 3627867688 ecr 3671661364], length 5684
14:25:53.361126 IP 192.168.0.100.52158 > 160.97.62.1.443: Flags [.], ack 5685, win 317, options [nop,nop,TS val 3671661373 ecr 3627867688], length 0
14:25:53.361131 IP 160.97.62.1.443 > 192.168.0.100.52156: Flags [.], seq 1:1329, ack 518, win 972, options [nop,nop,TS val 3627867688 ecr 3671661364], length 1328
14:25:53.361135 IP 192.168.0.100.52156 > 160.97.62.1.443: Flags [.], ack 1329, win 251, options [nop,nop,TS val 3671661373 ecr 3627867688], length 0
14:25:53.361771 IP 160.97.62.1.443 > 192.168.0.100.52156: Flags [P.], seq 1329:5685, ack 518, win 972, options [nop,nop,TS val 3627867688 ecr 3671661364], length 4356
14:25:53.361786 IP 192.168.0.100.52156 > 160.97.62.1.443: Flags [.], ack 5685, win 319, options [nop,nop,TS val 3671661373 ecr 3627867688], length 0
14:25:53.361788 IP 160.97.62.1.443 > 192.168.0.100.52154: Flags [P.], seq 5685:5959, ack 644, win 972, options [nop,nop,TS val 3627867688 ecr 3671661372], length 274
14:25:53.361929 IP 192.168.0.100.52158 > 160.97.62.1.443: Flags [P.], seq 518:644, ack 5685, win 317, options [nop,nop,TS val 3671661373 ecr 3627867688], length 126
14:25:53.362422 IP 160.97.62.1.443 > 192.168.0.100.52150: Flags [P.], seq 5685:5959, ack 644, win 972, options [nop,nop,TS val 3627867688 ecr 3671661372], length 274
14:25:53.362434 IP 160.97.62.1.443 > 192.168.0.100.52152: Flags [P.], seq 5685:5959, ack 644, win 972, options [nop,nop,TS val 3627867688 ecr 3671661372], length 274
14:25:53.362674 IP 192.168.0.100.52156 > 160.97.62.1.443: Flags [P.], seq 518:644, ack 5685, win 319, options [nop,nop,TS val 3671661373 ecr 3627867688], length 126
14:25:53.363382 IP 94.31.29.54.443 > 192.168.0.100.60988: Flags [S.], seq 1152989205, ack 1679241985, win 29200, options [mss 1340,nop,nop,sackOK,nop,wscale 10], length 0
14:25:53.363399 IP 192.168.0.100.60988 > 94.31.29.54.443: Flags [.], ack 1, win 229, length 0
14:25:53.363478 IP 192.168.0.100.60988 > 94.31.29.54.443: Flags [P.], seq 1:204, ack 1, win 229, length 203
14:25:53.364392 IP 216.58.205.200.443 > 192.168.0.100.47172: UDP, length 1350
14:25:53.364415 IP 216.58.205.200.443 > 192.168.0.100.47172: UDP, length 31
14:25:53.364785 IP 192.168.0.100.47172 > 216.58.205.200.443: UDP, length 39
14:25:53.364847 IP 192.168.0.100.47172 > 216.58.205.200.443: UDP, length 38
14:25:53.365189 IP 160.97.62.1.443 > 192.168.0.100.52158: Flags [P.], seq 5685:5959, ack 644, win 972, options [nop,nop,TS val 3627867689 ecr 3671661373], length 274
14:25:53.365222 IP 160.97.62.1.443 > 192.168.0.100.52156: Flags [P.], seq 5685:5959, ack 644, win 972, options [nop,nop,TS val 3627867689 ecr 3671661373], length 274
14:25:53.384664 IP 216.58.205.200.443 > 192.168.0.100.47172: UDP, length 30
14:25:53.399687 IP 160.97.62.1.443 > 192.168.0.100.52148: Flags [.], ack 1303, win 1055, options [nop,nop,TS val 3627867698 ecr 3671661372], length 0
14:25:53.404301 IP 192.168.0.100.52152 > 160.97.62.1.443: Flags [.], ack 5959, win 340, options [nop,nop,TS val 3671661384 ecr 3627867688], length 0
14:25:53.404311 IP 192.168.0.100.52150 > 160.97.62.1.443: Flags [.], ack 5959, win 338, options [nop,nop,TS val 3671661384 ecr 3627867688], length 0
14:25:53.404315 IP 192.168.0.100.52154 > 160.97.62.1.443: Flags [.], ack 5959, win 338, options [nop,nop,TS val 3671661384 ecr 3627867688], length 0
14:25:53.404591 IP 94.31.29.54.443 > 192.168.0.100.60988: Flags [.], ack 204, win 30, length 0
14:25:53.408116 IP 94.31.29.54.443 > 192.168.0.100.60988: Flags [P.], seq 1:5870, ack 204, win 30, length 5869
14:25:53.408159 IP 192.168.0.100.60988 > 94.31.29.54.443: Flags [.], ack 5870, win 320, length 0
14:25:53.408295 IP 192.168.0.100.52158 > 160.97.62.1.443: Flags [.], ack 5959, win 338, options [nop,nop,TS val 3671661385 ecr 3627867689], length 0
14:25:53.408428 IP 192.168.0.100.52156 > 160.97.62.1.443: Flags [.], ack 5959, win 340, options [nop,nop,TS val 3671661385 ecr 3627867689], length 0
14:25:53.409828 IP 192.168.0.100.60988 > 94.31.29.54.443: Flags [P.], seq 204:330, ack 5870, win 320, length 126
14:25:53.426357 IP 192.168.0.1.50080 > 239.255.255.250.1900: UDP, length 273
14:25:53.452760 IP 94.31.29.54.443 > 192.168.0.100.60988: Flags [P.], seq 5870:6128, ack 330, win 30, length 258
14:25:53.452805 IP 94.31.29.54.443 > 192.168.0.100.60988: Flags [P.], seq 6128:6197, ack 330, win 30, length 69
14:25:53.500314 IP 192.168.0.100.60988 > 94.31.29.54.443: Flags [.], ack 6197, win 341, length 0
14:25:53.530159 IP 192.168.0.1.50080 > 239.255.255.250.1900: UDP, length 312
14:25:53.538336 IP 94.31.29.54.443 > 192.168.0.100.60988: Flags [P.], seq 6128:6197, ack 330, win 30, length 69
14:25:53.538370 IP 192.168.0.100.60988 > 94.31.29.54.443: Flags [.], ack 6197, win 341, options [nop,nop,sack 1 {6128:6197}], length 0
14:25:53.634296 IP 192.168.0.1.50080 > 239.255.255.250.1900: UDP, length 344
14:25:53.738338 IP 192.168.0.1.50080 > 239.255.255.250.1900: UDP, length 273
14:25:53.842256 IP 192.168.0.1.50080 > 239.255.255.250.1900: UDP, length 332
14:25:53.946346 IP 192.168.0.1.50080 > 239.255.255.250.1900: UDP, length 326
14:25:54.050372 IP 192.168.0.1.50080 > 239.255.255.250.1900: UDP, length 273
14:25:54.154215 IP 192.168.0.1.50080 > 239.255.255.250.1900: UDP, length 328
14:25:54.258366 IP 192.168.0.1.50080 > 239.255.255.250.1900: UDP, length 338
14:25:54.748397 IP 160.97.62.1.443 > 192.168.0.100.52148: Flags [.], seq 5959:13927, ack 1303, win 1055, options [nop,nop,TS val 3627868034 ecr 3671661372], length 7968
14:25:54.748449 IP 192.168.0.100.52148 > 160.97.62.1.443: Flags [.], ack 13927, win 463, options [nop,nop,TS val 3671661720 ecr 3627868034], length 0
14:25:54.749007 IP 160.97.62.1.443 > 192.168.0.100.52148: Flags [P.], seq 13927:14341, ack 1303, win 1055, options [nop,nop,TS val 3627868034 ecr 3671661372], length 414
14:25:54.749027 IP 160.97.62.1.443 > 192.168.0.100.52148: Flags [P.], seq 14341:14378, ack 1303, win 1055, options [nop,nop,TS val 3627868034 ecr 3671661372], length 37
14:25:54.753226 IP 192.168.0.100.52148 > 160.97.62.1.443: Flags [.], ack 14378, win 483, options [nop,nop,TS val 3671661721 ecr 3627868034], length 0
14:25:54.888547 IP 192.168.0.100.44073 > 216.58.205.206.443: UDP, length 411
14:25:54.931959 IP 216.58.205.206.443 > 192.168.0.100.44073: UDP, length 114
14:25:54.931985 IP 216.58.205.206.443 > 192.168.0.100.44073: UDP, length 18
14:25:54.932165 IP 192.168.0.100.44073 > 216.58.205.206.443: UDP, length 41
14:25:55.792334 IP 192.168.0.100.43714 > 216.58.205.206.443: Flags [.], ack 3451584083, win 359, options [nop,nop,TS val 2757271837 ecr 178590510], length 0
14:25:55.813845 IP 216.58.205.206.443 > 192.168.0.100.43714: Flags [.], ack 1, win 188, options [nop,nop,TS val 178635566 ecr 2757237561], length 0
14:25:55.893156 IP 192.168.0.100.41977 > 172.217.23.106.443: UDP, length 77
14:25:55.893245 IP 192.168.0.100.41977 > 172.217.23.106.443: UDP, length 192
14:25:55.895355 IP 192.168.0.100.50336 > 216.58.205.195.443: UDP, length 202
14:25:55.895419 IP 192.168.0.100.50336 > 216.58.205.195.443: UDP, length 24
14:25:55.915353 IP 172.217.23.106.443 > 192.168.0.100.41977: UDP, length 33
14:25:55.916020 IP 216.58.205.195.443 > 192.168.0.100.50336: UDP, length 32
14:25:55.945113 IP 216.58.205.195.443 > 192.168.0.100.50336: UDP, length 59
14:25:55.945149 IP 216.58.205.195.443 > 192.168.0.100.50336: UDP, length 17
14:25:55.945333 IP 192.168.0.100.50336 > 216.58.205.195.443: UDP, length 44
14:25:56.026959 IP 172.217.23.106.443 > 192.168.0.100.41977: UDP, length 196
14:25:56.026988 IP 172.217.23.106.443 > 192.168.0.100.41977: UDP, length 36
14:25:56.027214 IP 192.168.0.100.41977 > 172.217.23.106.443: UDP, length 41
14:25:56.626913 IP 192.168.0.100.50336 > 216.58.205.195.443: UDP, length 176
14:25:56.626959 IP 192.168.0.100.50336 > 216.58.205.195.443: UDP, length 24
14:25:56.629425 IP 192.168.0.100.54544 > 216.58.205.206.443: UDP, length 1350
14:25:56.631093 IP 192.168.0.100.37474 > 216.58.205.193.443: UDP, length 1350
14:25:56.633695 IP 192.168.0.100.60016 > 216.58.205.195.443: UDP, length 1350
14:25:56.635915 IP 192.168.0.100.50336 > 216.58.205.195.443: UDP, length 150
14:25:56.649043 IP 216.58.205.195.443 > 192.168.0.100.50336: UDP, length 35
14:25:56.660885 IP 192.168.0.100.54544 > 216.58.205.206.443: UDP, length 1350
14:25:56.661994 IP 192.168.0.100.37474 > 216.58.205.193.443: UDP, length 1350
14:25:56.665117 IP 192.168.0.100.60016 > 216.58.205.195.443: UDP, length 1350
14:25:56.668861 IP 216.58.205.206.443 > 192.168.0.100.54544: UDP, length 1350
14:25:56.668885 IP 216.58.205.206.443 > 192.168.0.100.54544: UDP, length 31
14:25:56.669392 IP 192.168.0.100.54544 > 216.58.205.206.443: UDP, length 39
14:25:56.669485 IP 192.168.0.100.54544 > 216.58.205.206.443: UDP, length 38
14:25:56.670991 IP 216.58.205.193.443 > 192.168.0.100.37474: UDP, length 1350
14:25:56.671024 IP 216.58.205.193.443 > 192.168.0.100.37474: UDP, length 31
14:25:56.671511 IP 192.168.0.100.37474 > 216.58.205.193.443: UDP, length 39
14:25:56.671588 IP 192.168.0.100.37474 > 216.58.205.193.443: UDP, length 38
14:25:56.672171 IP 216.58.205.195.443 > 192.168.0.100.60016: UDP, length 1350
14:25:56.672188 IP 216.58.205.195.443 > 192.168.0.100.60016: UDP, length 31
14:25:56.673372 IP 192.168.0.100.60016 > 216.58.205.195.443: UDP, length 39
14:25:56.673497 IP 192.168.0.100.60016 > 216.58.205.195.443: UDP, length 38
14:25:56.682626 IP 216.58.205.195.443 > 192.168.0.100.50336: UDP, length 29
14:25:56.691244 IP 216.58.205.206.443 > 192.168.0.100.54544: UDP, length 30
14:25:56.692779 IP 216.58.205.193.443 > 192.168.0.100.37474: UDP, length 30
14:25:56.693802 IP 216.58.205.195.443 > 192.168.0.100.60016: UDP, length 30
14:25:56.763306 IP 216.58.205.195.443 > 192.168.0.100.50336: UDP, length 59
14:25:56.767681 IP 216.58.205.195.443 > 192.168.0.100.50336: UDP, length 17
14:25:56.767754 IP 192.168.0.100.50336 > 216.58.205.195.443: UDP, length 44
14:25:56.773192 IP 216.58.205.195.443 > 192.168.0.100.50336: UDP, length 697
14:25:56.773216 IP 216.58.205.195.443 > 192.168.0.100.50336: UDP, length 50
14:25:56.773354 IP 192.168.0.100.50336 > 216.58.205.195.443: UDP, length 38
14:25:56.773405 IP 192.168.0.100.50336 > 216.58.205.195.443: UDP, length 38
14:25:56.774660 IP 216.58.205.195.443 > 192.168.0.100.50336: UDP, length 1350
14:25:56.774681 IP 216.58.205.195.443 > 192.168.0.100.50336: UDP, length 1350
14:25:56.774684 IP 216.58.205.195.443 > 192.168.0.100.50336: UDP, length 1350
14:25:56.774687 IP 216.58.205.195.443 > 192.168.0.100.50336: UDP, length 1350
14:25:56.774752 IP 192.168.0.100.50336 > 216.58.205.195.443: UDP, length 38
14:25:56.774786 IP 192.168.0.100.50336 > 216.58.205.195.443: UDP, length 38
14:25:56.774813 IP 192.168.0.100.50336 > 216.58.205.195.443: UDP, length 41
14:25:56.776827 IP 216.58.205.195.443 > 192.168.0.100.50336: UDP, length 1350
14:25:56.778955 IP 216.58.205.195.443 > 192.168.0.100.50336: UDP, length 1350
14:25:56.778971 IP 216.58.205.195.443 > 192.168.0.100.50336: UDP, length 1350
14:25:56.779029 IP 192.168.0.100.50336 > 216.58.205.195.443: UDP, length 43
14:25:56.779065 IP 192.168.0.100.50336 > 216.58.205.195.443: UDP, length 40
14:25:56.796825 IP 216.58.205.195.443 > 192.168.0.100.50336: UDP, length 1350
14:25:56.797072 IP 192.168.0.100.50336 > 216.58.205.195.443: UDP, length 42
14:25:56.799918 IP 216.58.205.195.443 > 192.168.0.100.50336: UDP, length 1350
14:25:56.799938 IP 216.58.205.195.443 > 192.168.0.100.50336: UDP, length 1350
14:25:56.799942 IP 216.58.205.195.443 > 192.168.0.100.50336: UDP, length 1350
14:25:56.799945 IP 216.58.205.195.443 > 192.168.0.100.50336: UDP, length 1350
14:25:56.800021 IP 192.168.0.100.50336 > 216.58.205.195.443: UDP, length 42
14:25:56.800070 IP 192.168.0.100.50336 > 216.58.205.195.443: UDP, length 42
14:25:56.800098 IP 192.168.0.100.50336 > 216.58.205.195.443: UDP, length 42
14:25:56.804180 IP 216.58.205.195.443 > 192.168.0.100.50336: UDP, length 1350
14:25:56.804212 IP 216.58.205.195.443 > 192.168.0.100.50336: UDP, length 1350
14:25:56.804220 IP 216.58.205.195.443 > 192.168.0.100.50336: UDP, length 1350
14:25:56.804337 IP 192.168.0.100.50336 > 216.58.205.195.443: UDP, length 45
14:25:56.804410 IP 192.168.0.100.50336 > 216.58.205.195.443: UDP, length 45
14:25:56.819106 IP 216.58.205.195.443 > 192.168.0.100.50336: UDP, length 1350
14:25:56.819148 IP 216.58.205.195.443 > 192.168.0.100.50336: UDP, length 1350
14:25:56.819358 IP 192.168.0.100.50336 > 216.58.205.195.443: UDP, length 45
14:25:56.821525 IP 216.58.205.195.443 > 192.168.0.100.50336: UDP, length 1350
14:25:56.821547 IP 216.58.205.195.443 > 192.168.0.100.50336: UDP, length 1350
14:25:56.821550 IP 216.58.205.195.443 > 192.168.0.100.50336: UDP, length 1350
14:25:56.821553 IP 216.58.205.195.443 > 192.168.0.100.50336: UDP, length 1350
14:25:56.821675 IP 192.168.0.100.50336 > 216.58.205.195.443: UDP, length 45
14:25:56.821724 IP 192.168.0.100.50336 > 216.58.205.195.443: UDP, length 45
14:25:56.823205 IP 216.58.205.195.443 > 192.168.0.100.50336: UDP, length 1350
14:25:56.823218 IP 216.58.205.195.443 > 192.168.0.100.50336: UDP, length 1350
14:25:56.823288 IP 192.168.0.100.50336 > 216.58.205.195.443: UDP, length 45
14:25:56.826475 IP 216.58.205.195.443 > 192.168.0.100.50336: UDP, length 1350
14:25:56.826492 IP 216.58.205.195.443 > 192.168.0.100.50336: UDP, length 886
14:25:56.826633 IP 192.168.0.100.50336 > 216.58.205.195.443: UDP, length 45
14:25:56.979025 IP 216.58.205.195.443 > 192.168.0.100.50336: UDP, length 1350
14:25:56.979051 IP 216.58.205.195.443 > 192.168.0.100.50336: UDP, length 1350
14:25:56.979055 IP 216.58.205.195.443 > 192.168.0.100.50336: UDP, length 1350
14:25:56.979058 IP 216.58.205.195.443 > 192.168.0.100.50336: UDP, length 1350
14:25:56.979061 IP 216.58.205.195.443 > 192.168.0.100.50336: UDP, length 1350
14:25:56.979064 IP 216.58.205.195.443 > 192.168.0.100.50336: UDP, length 1350
14:25:56.979195 IP 192.168.0.100.50336 > 216.58.205.195.443: UDP, length 51
14:25:56.979245 IP 192.168.0.100.50336 > 216.58.205.195.443: UDP, length 38
14:25:56.979279 IP 192.168.0.100.50336 > 216.58.205.195.443: UDP, length 38
14:25:56.979664 IP 216.58.205.195.443 > 192.168.0.100.50336: UDP, length 391
14:25:57.001043 IP 216.58.205.195.443 > 192.168.0.100.50336: UDP, length 1350
14:25:57.001111 IP 216.58.205.195.443 > 192.168.0.100.50336: UDP, length 1350
14:25:57.001126 IP 216.58.205.195.443 > 192.168.0.100.50336: UDP, length 1350
14:25:57.001133 IP 216.58.205.195.443 > 192.168.0.100.50336: UDP, length 1265
14:25:57.001283 IP 192.168.0.100.50336 > 216.58.205.195.443: UDP, length 38
14:25:57.001320 IP 192.168.0.100.50336 > 216.58.205.195.443: UDP, length 38
14:25:57.011536 IP 192.168.0.100.50336 > 216.58.205.195.443: UDP, length 345
14:25:57.011609 IP 192.168.0.100.50336 > 216.58.205.195.443: UDP, length 24
14:25:57.015434 IP 216.58.205.195.443 > 192.168.0.100.50336: UDP, length 1350
14:25:57.015451 IP 216.58.205.195.443 > 192.168.0.100.50336: UDP, length 1350
14:25:57.015453 IP 216.58.205.195.443 > 192.168.0.100.50336: UDP, length 1350
14:25:57.015455 IP 216.58.205.195.443 > 192.168.0.100.50336: UDP, length 1350
14:25:57.015814 IP 192.168.0.100.50336 > 216.58.205.195.443: UDP, length 38
14:25:57.015851 IP 192.168.0.100.50336 > 216.58.205.195.443: UDP, length 38
14:25:57.016863 IP 216.58.205.195.443 > 192.168.0.100.50336: UDP, length 1350
14:25:57.016875 IP 216.58.205.195.443 > 192.168.0.100.50336: UDP, length 1350
14:25:57.016877 IP 216.58.205.195.443 > 192.168.0.100.50336: UDP, length 1350
14:25:57.016879 IP 216.58.205.195.443 > 192.168.0.100.50336: UDP, length 1350
14:25:57.017166 IP 192.168.0.100.50336 > 216.58.205.195.443: UDP, length 38
14:25:57.017209 IP 192.168.0.100.50336 > 216.58.205.195.443: UDP, length 38
14:25:57.018066 IP 216.58.205.195.443 > 192.168.0.100.50336: UDP, length 1350
14:25:57.018075 IP 216.58.205.195.443 > 192.168.0.100.50336: UDP, length 1350
14:25:57.018078 IP 216.58.205.195.443 > 192.168.0.100.50336: UDP, length 1350
14:25:57.018080 IP 216.58.205.195.443 > 192.168.0.100.50336: UDP, length 1350
14:25:57.018375 IP 192.168.0.100.50336 > 216.58.205.195.443: UDP, length 38
14:25:57.018421 IP 192.168.0.100.50336 > 216.58.205.195.443: UDP, length 38
14:25:57.020082 IP 216.58.205.195.443 > 192.168.0.100.50336: UDP, length 1350
14:25:57.020094 IP 216.58.205.195.443 > 192.168.0.100.50336: UDP, length 1350
14:25:57.020097 IP 216.58.205.195.443 > 192.168.0.100.50336: UDP, length 1350
14:25:57.020099 IP 216.58.205.195.443 > 192.168.0.100.50336: UDP, length 1350
14:25:57.020100 IP 216.58.205.195.443 > 192.168.0.100.50336: UDP, length 1350
14:25:57.020101 IP 216.58.205.195.443 > 192.168.0.100.50336: UDP, length 1350
14:25:57.020576 IP 192.168.0.100.50336 > 216.58.205.195.443: UDP, length 38
14:25:57.020628 IP 192.168.0.100.50336 > 216.58.205.195.443: UDP, length 38
14:25:57.020681 IP 192.168.0.100.50336 > 216.58.205.195.443: UDP, length 38
14:25:57.021129 IP 216.58.205.195.443 > 192.168.0.100.50336: UDP, length 1350
14:25:57.021139 IP 216.58.205.195.443 > 192.168.0.100.50336: UDP, length 1350
14:25:57.021142 IP 216.58.205.195.443 > 192.168.0.100.50336: UDP, length 1350
14:25:57.021145 IP 216.58.205.195.443 > 192.168.0.100.50336: UDP, length 1350
14:25:57.021545 IP 192.168.0.100.50336 > 216.58.205.195.443: UDP, length 38
14:25:57.021584 IP 192.168.0.100.50336 > 216.58.205.195.443: UDP, length 38
14:25:57.021771 IP 216.58.205.195.443 > 192.168.0.100.50336: UDP, length 1350
14:25:57.022586 IP 216.58.205.195.443 > 192.168.0.100.50336: UDP, length 1350
14:25:57.022603 IP 216.58.205.195.443 > 192.168.0.100.50336: UDP, length 1350
14:25:57.022610 IP 216.58.205.195.443 > 192.168.0.100.50336: UDP, length 1350
14:25:57.022615 IP 216.58.205.195.443 > 192.168.0.100.50336: UDP, length 957
14:25:57.022685 IP 192.168.0.100.50336 > 216.58.205.195.443: UDP, length 38
14:25:57.022725 IP 192.168.0.100.50336 > 216.58.205.195.443: UDP, length 38
14:25:57.032412 IP 216.58.205.195.443 > 192.168.0.100.50336: UDP, length 32
14:25:57.048107 IP 192.168.0.100.50336 > 216.58.205.195.443: UDP, length 38
14:25:57.051890 IP 216.58.205.195.443 > 192.168.0.100.50336: UDP, length 109
14:25:57.051931 IP 216.58.205.195.443 > 192.168.0.100.50336: UDP, length 17
14:25:57.052137 IP 192.168.0.100.50336 > 216.58.205.195.443: UDP, length 38
14:25:57.183488 IP 192.168.0.100.50336 > 216.58.205.195.443: UDP, length 352
14:25:57.183532 IP 192.168.0.100.50336 > 216.58.205.195.443: UDP, length 24
14:25:57.185301 IP 192.168.0.100.37455 > 216.58.205.130.443: UDP, length 272
14:25:57.204012 IP 216.58.205.195.443 > 192.168.0.100.50336: UDP, length 38
14:25:57.229806 IP 216.58.205.130.443 > 192.168.0.100.37455: UDP, length 74
14:25:57.229827 IP 216.58.205.130.443 > 192.168.0.100.37455: UDP, length 16
14:25:57.230017 IP 192.168.0.100.37455 > 216.58.205.130.443: UDP, length 41
14:25:57.230788 IP 216.58.205.195.443 > 192.168.0.100.50336: UDP, length 36
14:25:57.230807 IP 216.58.205.195.443 > 192.168.0.100.50336: UDP, length 17
14:25:57.230967 IP 192.168.0.100.50336 > 216.58.205.195.443: UDP, length 41
14:25:57.313689 IP 192.168.0.100.54544 > 216.58.205.206.443: UDP, length 810
14:25:57.313735 IP 192.168.0.100.54544 > 216.58.205.206.443: UDP, length 127
14:25:57.333956 IP 216.58.205.206.443 > 192.168.0.100.54544: UDP, length 30
14:25:57.546439 IP 216.58.205.206.443 > 192.168.0.100.54544: UDP, length 948
14:25:57.546457 IP 216.58.205.206.443 > 192.168.0.100.54544: UDP, length 28
14:25:57.546460 IP 216.58.205.206.443 > 192.168.0.100.54544: UDP, length 244
14:25:57.546769 IP 192.168.0.100.54544 > 216.58.205.206.443: UDP, length 44
14:25:57.572198 IP 192.168.0.100.54544 > 216.58.205.206.443: UDP, length 35
14:25:57.576884 IP 216.58.198.34.443 > 192.168.0.100.47865: UDP, length 1350
14:25:57.576932 IP 192.168.0.100 > 216.58.198.34: ICMP 192.168.0.100 udp port 47865 unreachable, length 556
14:25:57.750479 IP 192.168.0.100.50336 > 216.58.205.195.443: UDP, length 338
14:25:57.750510 IP 192.168.0.100.50336 > 216.58.205.195.443: UDP, length 24
14:25:57.751027 IP 192.168.0.100.50336 > 216.58.205.195.443: UDP, length 176
14:25:57.751054 IP 192.168.0.100.50336 > 216.58.205.195.443: UDP, length 24
14:25:57.771753 IP 216.58.205.195.443 > 192.168.0.100.50336: UDP, length 38
14:25:57.792803 IP 216.58.205.195.443 > 192.168.0.100.50336: UDP, length 50
14:25:57.792823 IP 216.58.205.195.443 > 192.168.0.100.50336: UDP, length 17
14:25:57.792961 IP 192.168.0.100.50336 > 216.58.205.195.443: UDP, length 41
14:25:57.798331 IP 216.58.205.195.443 > 192.168.0.100.50336: UDP, length 36
14:25:57.798346 IP 216.58.205.195.443 > 192.168.0.100.50336: UDP, length 17
14:25:57.798433 IP 192.168.0.100.50336 > 216.58.205.195.443: UDP, length 38
14:25:58.389648 IP 192.168.0.100.41977 > 172.217.23.106.443: UDP, length 76
14:25:58.389691 IP 192.168.0.100.41977 > 172.217.23.106.443: UDP, length 132
14:25:58.409707 IP 172.217.23.106.443 > 192.168.0.100.41977: UDP, length 33
14:25:58.603553 IP 172.217.23.106.443 > 192.168.0.100.41977: UDP, length 371
14:25:58.603580 IP 172.217.23.106.443 > 192.168.0.100.41977: UDP, length 106
14:25:58.603781 IP 192.168.0.100.41977 > 172.217.23.106.443: UDP, length 41
14:25:59.021358 IP 192.168.0.100.36679 > 192.168.0.1.53: 65336+ [1au] A? wwu-pi.github.io. (67)
14:25:59.021523 IP 192.168.0.100.46482 > 192.168.0.1.53: 3126+ [1au] A? sni.github.map.fastly.net. (76)
14:25:59.021567 IP 192.168.0.100.47889 > 160.97.62.2.53: 56148+ [1au] A? sni.github.map.fastly.net. (76)
14:25:59.062665 IP 192.168.0.1.53 > 192.168.0.100.46482: 3126 1/4/5 A 151.101.121.147 (206)
14:25:59.062687 IP 192.168.0.1.53 > 192.168.0.100.36679: 65336 2/4/5 CNAME sni.github.map.fastly.net., A 151.101.121.147 (236)
14:25:59.062707 IP 192.168.0.100 > 192.168.0.1: ICMP 192.168.0.100 udp port 36679 unreachable, length 272
14:25:59.062710 IP 160.97.62.2.53 > 192.168.0.100.47889: 56148 1/4/5 A 151.101.121.147 (206)
14:25:59.063149 IP 192.168.0.100.34648 > 151.101.121.147.443: Flags [S], seq 3804857898, win 29200, options [mss 1460,sackOK,TS val 3131933568 ecr 0,nop,wscale 7], length 0
14:25:59.107866 IP 151.101.121.147.443 > 192.168.0.100.34648: Flags [S.], seq 1469695462, ack 3804857899, win 27680, options [mss 1340,sackOK,TS val 2837462938 ecr 3131933568,nop,wscale 9], length 0
14:25:59.107948 IP 192.168.0.100.34648 > 151.101.121.147.443: Flags [.], ack 1, win 229, options [nop,nop,TS val 3131933579 ecr 2837462938], length 0
14:25:59.108216 IP 192.168.0.100.34648 > 151.101.121.147.443: Flags [P.], seq 1:518, ack 1, win 229, options [nop,nop,TS val 3131933579 ecr 2837462938], length 517
14:25:59.152962 IP 151.101.121.147.443 > 192.168.0.100.34648: Flags [.], ack 518, win 57, options [nop,nop,TS val 2837462949 ecr 3131933579], length 0
14:25:59.152993 IP 151.101.121.147.443 > 192.168.0.100.34648: Flags [P.], seq 1:155, ack 518, win 57, options [nop,nop,TS val 2837462949 ecr 3131933579], length 154
14:25:59.153009 IP 192.168.0.100.34648 > 151.101.121.147.443: Flags [.], ack 155, win 237, options [nop,nop,TS val 3131933591 ecr 2837462949], length 0
14:25:59.153193 IP 192.168.0.100.34648 > 151.101.121.147.443: Flags [P.], seq 518:569, ack 155, win 237, options [nop,nop,TS val 3131933591 ecr 2837462949], length 51
14:25:59.155406 IP 192.168.0.100.34648 > 151.101.121.147.443: Flags [P.], seq 569:662, ack 155, win 237, options [nop,nop,TS val 3131933591 ecr 2837462949], length 93
14:25:59.155616 IP 192.168.0.100.34648 > 151.101.121.147.443: Flags [P.], seq 662:1017, ack 155, win 237, options [nop,nop,TS val 3131933591 ecr 2837462949], length 355
14:25:59.185261 IP 160.97.62.90.53694 > 224.0.0.252.5355: UDP, length 21
14:25:59.185305 IP 160.97.62.90.59040 > 224.0.0.252.5355: UDP, length 21
14:25:59.201088 IP 151.101.121.147.443 > 192.168.0.100.34648: Flags [.], ack 662, win 57, options [nop,nop,TS val 2837462961 ecr 3131933591], length 0
14:25:59.201143 IP 151.101.121.147.443 > 192.168.0.100.34648: Flags [P.], seq 155:221, ack 1017, win 59, options [nop,nop,TS val 2837462961 ecr 3131933591], length 66
14:25:59.201331 IP 192.168.0.100.34648 > 151.101.121.147.443: Flags [P.], seq 1017:1055, ack 221, win 237, options [nop,nop,TS val 3131933603 ecr 2837462961], length 38
14:25:59.286768 IP 151.101.121.147.443 > 192.168.0.100.34648: Flags [.], ack 1055, win 59, options [nop,nop,TS val 2837462983 ecr 3131933603], length 0
14:25:59.295747 IP 151.101.121.147.443 > 192.168.0.100.34648: Flags [P.], seq 221:478, ack 1055, win 59, options [nop,nop,TS val 2837462985 ecr 3131933603], length 257
14:25:59.296232 IP 192.168.0.100.34648 > 151.101.121.147.443: Flags [P.], seq 1055:1097, ack 478, win 245, options [nop,nop,TS val 3131933626 ecr 2837462985], length 42
14:25:59.311759 IP 192.168.0.100.34648 > 151.101.121.147.443: Flags [P.], seq 1097:1267, ack 478, win 245, options [nop,nop,TS val 3131933630 ecr 2837462985], length 170
14:25:59.311804 IP 192.168.0.100.34648 > 151.101.121.147.443: Flags [P.], seq 1267:1352, ack 478, win 245, options [nop,nop,TS val 3131933630 ecr 2837462985], length 85
14:25:59.311822 IP 192.168.0.100.34648 > 151.101.121.147.443: Flags [P.], seq 1352:1433, ack 478, win 245, options [nop,nop,TS val 3131933630 ecr 2837462985], length 81
14:25:59.312268 IP 192.168.0.100.34648 > 151.101.121.147.443: Flags [P.], seq 1433:1527, ack 478, win 245, options [nop,nop,TS val 3131933630 ecr 2837462985], length 94
14:25:59.313230 IP 192.168.0.100.34648 > 151.101.121.147.443: Flags [P.], seq 1527:1615, ack 478, win 245, options [nop,nop,TS val 3131933631 ecr 2837462985], length 88
14:25:59.342140 IP 151.101.121.147.443 > 192.168.0.100.34648: Flags [.], ack 1097, win 59, options [nop,nop,TS val 2837462996 ecr 3131933626], length 0
14:25:59.356346 IP 151.101.121.147.443 > 192.168.0.100.34648: Flags [.], ack 1267, win 61, options [nop,nop,TS val 2837463000 ecr 3131933630], length 0
14:25:59.356397 IP 151.101.121.147.443 > 192.168.0.100.34648: Flags [.], ack 1352, win 61, options [nop,nop,TS val 2837463000 ecr 3131933630], length 0
14:25:59.356403 IP 151.101.121.147.443 > 192.168.0.100.34648: Flags [.], ack 1433, win 61, options [nop,nop,TS val 2837463000 ecr 3131933630], length 0
14:25:59.356407 IP 151.101.121.147.443 > 192.168.0.100.34648: Flags [.], ack 1527, win 61, options [nop,nop,TS val 2837463000 ecr 3131933630], length 0
14:25:59.357766 IP 151.101.121.147.443 > 192.168.0.100.34648: Flags [.], ack 1615, win 61, options [nop,nop,TS val 2837463000 ecr 3131933631], length 0
14:25:59.449205 IP 151.101.121.147.443 > 192.168.0.100.34648: Flags [P.], seq 478:622, ack 1615, win 61, options [nop,nop,TS val 2837463023 ecr 3131933631], length 144
14:25:59.449618 IP 192.168.0.100.34648 > 151.101.121.147.443: Flags [P.], seq 1615:1657, ack 622, win 254, options [nop,nop,TS val 3131933665 ecr 2837463023], length 42
14:25:59.454342 IP 151.101.121.147.443 > 192.168.0.100.34648: Flags [P.], seq 622:734, ack 1615, win 61, options [nop,nop,TS val 2837463024 ecr 3131933631], length 112
14:25:59.454669 IP 192.168.0.100.34648 > 151.101.121.147.443: Flags [P.], seq 1657:1699, ack 734, win 254, options [nop,nop,TS val 3131933666 ecr 2837463024], length 42
14:25:59.457695 IP 151.101.121.147.443 > 192.168.0.100.34648: Flags [P.], seq 734:869, ack 1615, win 61, options [nop,nop,TS val 2837463025 ecr 3131933631], length 135
14:25:59.461075 IP 151.101.121.147.443 > 192.168.0.100.34648: Flags [P.], seq 869:1006, ack 1615, win 61, options [nop,nop,TS val 2837463026 ecr 3131933631], length 137
14:25:59.461132 IP 192.168.0.100.34648 > 151.101.121.147.443: Flags [.], ack 1006, win 270, options [nop,nop,TS val 3131933668 ecr 2837463025], length 0
14:25:59.464449 IP 151.101.121.147.443 > 192.168.0.100.34648: Flags [P.], seq 1006:1141, ack 1615, win 61, options [nop,nop,TS val 2837463027 ecr 3131933631], length 135
14:25:59.464813 IP 192.168.0.100.34648 > 151.101.121.147.443: Flags [P.], seq 1699:1741, ack 1141, win 279, options [nop,nop,TS val 3131933669 ecr 2837463027], length 42
14:25:59.495372 IP 151.101.121.147.443 > 192.168.0.100.34648: Flags [.], ack 1657, win 61, options [nop,nop,TS val 2837463035 ecr 3131933665], length 0
14:25:59.499936 IP 151.101.121.147.443 > 192.168.0.100.34648: Flags [.], ack 1699, win 61, options [nop,nop,TS val 2837463036 ecr 3131933666], length 0
14:25:59.511265 IP 151.101.121.147.443 > 192.168.0.100.34648: Flags [.], ack 1741, win 61, options [nop,nop,TS val 2837463039 ecr 3131933669], length 0
14:25:59.595818 IP 160.97.62.90.53694 > 224.0.0.252.5355: UDP, length 21
14:25:59.595841 IP 160.97.62.90.59040 > 224.0.0.252.5355: UDP, length 21
14:26:00.270859 IP 160.97.62.159.58423 > 224.0.0.252.5355: UDP, length 29
